[
  {
    "price_id": "pr_000001",
    "product_id": "iphone_15_pro",
    "price": 27990000.0,
    "currency": "VND",
    "seller": "Apple Official Store",
    "timestamp": "2026-08-20T10:00:00Z",
    "source": "price_poller"
  },
  {
    "price_id": "pr_000002",
    "product_id": "iphone_15_pro",
    "price": 27570000.0,
    "currency": "VND",
    "seller": "Apple Official Store",
    "timestamp": "2026-08-21T10:00:00Z",
    "source": "price_poller"
  },
  {
    "price_id": "pr_000003",
    "product_id": "iphone_15_pro",
    "price": 28730000.0,
    "currency": "VND",
    "seller": "Apple Official Store",
    "timestamp": "2026-08-22T10:00:00Z",
    "source": "price_poller"
  },
  {
    "price_id": "pr_000004",
    "product_id": "iphone_15_pro",
    "price": 28690000.0,
    "currency": "VND",
    "seller": "Apple Official Store",
    "timestamp": "2026-08-23T10:00:00Z",
    "source": "price_poller"
  },
  {
    "price_id": "pr_000005",
    "product_id": "iphone_15_pro",
    "price": 28750000.0,
    "currency": "VND",
    "seller": "Apple Official Store",
    "timestamp": "2026-08-24T10:00:00Z",
    "source": "price_poller"
  },
  {
    "price_id": "pr_000006",
    "product_id": "iphone_15_pro",
    "price": 28640000.0,
    "currency": "VND",
    "seller": "Apple Official Store",
    "timestamp": "2026-08-25T10:00:00Z",
    "source": "price_poller"
  },
  {
    "price_id": "pr_000007",
    "product_id": "iphone_15_pro",
    "price": 27480000.0,
    "currency": "VND",
    "seller": "Apple Official Store",
    "timestamp": "2026-08-26T10:00:00Z",
    "source": "price_poller"
  },
  {
    "price_id": "pr_000008",
    "product_id": "iphone_15_pro",
    "price": 28130000.0,
    "currency": "VND",
    "seller": "Apple Official Store",
    "timestamp": "2026-08-27T10:00:00Z",
    "source": "price_poller"
  },
  {
    "price_id": "pr_000009",
    "product_id": "iphone_15_pro",
    "price": 28410000.0,
    "currency": "VND",
    "seller": "Apple Official Store",
    "timestamp": "2026-08-28T10:00:00Z",
    "source": "price_poller"
  },
  {
    "price_id": "pr_000010",
    "product_id": "iphone_15_pro",
    "price": 27910000.0,
    "currency": "VND",
    "seller": "Apple Official Store",
    "timestamp": "2026-08-29T10:00:00Z",
    "source": "price_poller"
  },
  {
    "price_id": "pr_000011",
    "product_id": "iphone_15_pro",
    "price": 27910000.0,
    "currency": "VND",
    "seller": "Apple Official Store",
    "timestamp": "2026-08-30T10:00:00Z",
    "source": "price_poller"
  },
  {
    "price_id": "pr_000012",
    "product_id": "iphone_15_pro",
    "price": 27560000.0,
    "currency": "VND",
    "seller": "Apple Official Store",
    "timestamp": "2026-08-31T10:00:00Z",
    "source": "price_poller"
  },
  {
    "price_id": "pr_000013",
    "product_id": "iphone_15_pro",
    "price": 27670000.0,
    "currency": "VND",
    "seller": "Apple Official Store",
    "timestamp": "2026-09-01T10:00:00Z",
    "source": "price_poller"
  },
  {
    "price_id": "pr_000014",
    "product_id": "iphone_15_pro",
    "price": 28630000.0,
    "currency": "VND",
    "seller": "Apple Official Store",
    "timestamp": "2026-09-02T10:00:00Z",
    "source": "price_poller"
  },
  {
    "price_id": "pr_000015",
    "product_id": "iphone_15_pro",
    "price": 27580000.0,
    "currency": "VND",
    "seller": "Apple Official Store",
    "timestamp": "2026-09-03T10:00:00Z",
    "source": "price_poller"
  },
  {
    "price_id": "pr_000016",
    "product_id": "iphone_15_pro",
    "price": 28330000.0,
    "currency": "VND",
    "seller": "Apple Official Store",
    "timestamp": "2026-09-04T10:00:00Z",
    "source": "price_poller"
  },
  {
    "price_id": "pr_000017",
    "product_id": "iphone_15_pro",
    "price": 27590000.0,
    "currency": "VND",
    "seller": "Apple Official Store",
    "timestamp": "2026-09-05T10:00:00Z",
    "source": "price_poller"
  },
  {
    "price_id": "pr_000018",
    "product_id": "iphone_15_pro",
    "price": 27980000.0,
    "currency": "VND",
    "seller": "Apple Official Store",
    "timestamp": "2026-09-06T10:00:00Z",
    "source": "price_poller"
  },
  {
    "price_id": "pr_000019",
    "product_id": "iphone_15_pro",
    "price": 27740000.0,
    "currency": "VND",
    "seller": "Apple Official Store",
    "timestamp": "2026-09-07T10:00:00Z",
    "source": "price_poller"
  },
  {
    "price_id": "pr_000020",
    "product_id": "iphone_15_pro",
    "price": 28470000.0,
    "currency": "VND",
    "seller": "Apple Official Store",
    "timestamp": "2026-09-08T10:00:00Z",
    "source": "price_poller"
  },
  {
    "price_id": "pr_000021",
    "product_id": "iphone_15_pro",
    "price": 28660000.0,
    "currency": "VND",
    "seller": "Apple Official Store",
    "timestamp": "2026-09-09T10:00:00Z",
    "source": "price_poller"
  },
  {
    "price_id": "pr_000022",
    "product_id": "iphone_15_pro",
    "price": 27960000.0,
    "currency": "VND",
    "seller": "Apple Official Store",
    "timestamp": "2026-09-10T10:00:00Z",
    "source": "price_poller"
  },
  {
    "price_id": "pr_000023",
    "product_id": "iphone_15_pro",
    "price": 28650000.0,
    "currency": "VND",
    "seller": "Apple Official Store",
    "timestamp": "2026-09-11T10:00:00Z",
    "source": "price_poller"
  },
  {
    "price_id": "pr_000024",
    "product_id": "iphone_15_pro",
    "price": 27640000.0,
    "currency": "VND",
    "seller": "Apple Official Store",
    "timestamp": "2026-09-12T10:00:00Z",
    "source": "price_poller"
  },
  {
    "price_id": "pr_000025",
    "product_id": "iphone_15_pro",
    "price": 27800000.0,
    "currency": "VND",
    "seller": "Apple Official Store",
    "timestamp": "2026-09-13T10:00:00Z",
    "source": "price_poller"
  },
  {
    "price_id": "pr_000026",
    "product_id": "iphone_15_pro",
    "price": 28520000.0,
    "currency": "VND",
    "seller": "Apple Official Store",
    "timestamp": "2026-09-14T10:00:00Z",
    "source": "price_poller"
  },
  {
    "price_id": "pr_000027",
    "product_id": "iphone_15_pro",
    "price": 28750000.0,
    "currency": "VND",
    "seller": "Apple Official Store",
    "timestamp": "2026-09-15T10:00:00Z",
    "source": "price_poller"
  },
  {
    "price_id": "pr_000028",
    "product_id": "iphone_15_pro",
    "price": 28200000.0,
    "currency": "VND",
    "seller": "Apple Official Store",
    "timestamp": "2026-09-16T10:00:00Z",
    "source": "price_poller"
  },
  {
    "price_id": "pr_000029",
    "product_id": "iphone_15_pro",
    "price": 28660000.0,
    "currency": "VND",
    "seller": "Apple Official Store",
    "timestamp": "2026-09-17T10:00:00Z",
    "source": "price_poller"
  },
  {
    "price_id": "pr_000030",
    "product_id": "iphone_15_pro",
    "price": 28250000.0,
    "currency": "VND",
    "seller": "Apple Official Store",
    "timestamp": "2026-09-18T10:00:00Z",
    "source": "price_poller"
  },
  {
    "price_id": "pr_000031",
    "product_id": "iphone_15_pro",
    "price": 27540000.0,
    "currency": "VND",
    "seller": "Apple Official Store",
    "timestamp": "2026-09-19T10:00:00Z",
    "source": "price_poller"
  },
  {
    "price_id": "pr_000032",
    "product_id": "iphone_15_pro",
    "price": 28060000.0,
    "currency": "VND",
    "seller": "Apple Official Store",
    "timestamp": "2026-09-20T10:00:00Z",
    "source": "price_poller"
  },
  {
    "price_id": "pr_000033",
    "product_id": "iphone_15_pro",
    "price": 28540000.0,
    "currency": "VND",
    "seller": "Apple Official Store",
    "timestamp": "2026-09-21T10:00:00Z",
    "source": "price_poller"
  },
  {
    "price_id": "pr_000034",
    "product_id": "iphone_15_pro",
    "price": 27620000.0,
    "currency": "VND",
    "seller": "Apple Official Store",
    "timestamp": "2026-09-22T10:00:00Z",
    "source": "price_poller"
  },
  {
    "price_id": "pr_000035",
    "product_id": "iphone_15_pro",
    "price": 27520000.0,
    "currency": "VND",
    "seller": "Apple Official Store",
    "timestamp": "2026-09-23T10:00:00Z",
    "source": "price_poller"
  },
  {
    "price_id": "pr_000036",
    "product_id": "iphone_15",
    "price": 19670000.0,
    "currency": "VND",
    "seller": "Apple Official Store",
    "timestamp": "2026-08-20T10:00:00Z",
    "source": "price_poller"
  },
  {
    "price_id": "pr_000037",
    "product_id": "iphone_15",
    "price": 19630000.0,
    "currency": "VND",
    "seller": "Apple Official Store",
    "timestamp": "2026-08-21T10:00:00Z",
    "source": "price_poller"
  },
  {
    "price_id": "pr_000038",
    "product_id": "iphone_15",
    "price": 19620000.0,
    "currency": "VND",
    "seller": "Apple Official Store",
    "timestamp": "2026-08-22T10:00:00Z",
    "source": "price_poller"
  },
  {
    "price_id": "pr_000039",
    "product_id": "iphone_15",
    "price": 19310000.0,
    "currency": "VND",
    "seller": "Apple Official Store",
    "timestamp": "2026-08-23T10:00:00Z",
    "source": "price_poller"
  },
  {
    "price_id": "pr_000040",
    "product_id": "iphone_15",
    "price": 19860000.0,
    "currency": "VND",
    "seller": "Apple Official Store",
    "timestamp": "2026-08-24T10:00:00Z",
    "source": "price_poller"
  },
  {
    "price_id": "pr_000041",
    "product_id": "iphone_15",
    "price": 19040000.0,
    "currency": "VND",
    "seller": "Apple Official Store",
    "timestamp": "2026-08-25T10:00:00Z",
    "source": "price_poller"
  },
  {
    "price_id": "pr_000042",
    "product_id": "iphone_15",
    "price": 18980000.0,
    "currency": "VND",
    "seller": "Apple Official Store",
    "timestamp": "2026-08-26T10:00:00Z",
    "source": "price_poller"
  },
  {
    "price_id": "pr_000043",
    "product_id": "iphone_15",
    "price": 19280000.0,
    "currency": "VND",
    "seller": "Apple Official Store",
    "timestamp": "2026-08-27T10:00:00Z",
    "source": "price_poller"
  },
  {
    "price_id": "pr_000044",
    "product_id": "iphone_15",
    "price": 19690000.0,
    "currency": "VND",
    "seller": "Apple Official Store",